<?xml version="1.0" encoding="UTF-8"?>
<!--

    ***************************************************************************
    Copyright (c) 2010 Qcadoo Limited
    Project: Qcadoo Framework
    Version: 1.2.0

    This file is part of Qcadoo.

    Qcadoo is free software; you can redistribute it and/or modify
    it under the terms of the GNU Affero General Public License as published
    by the Free Software Foundation; either version 3 of the License,
    or (at your option) any later version.

    This program is distributed in the hope that it will be useful,
    but WITHOUT ANY WARRANTY; without even the implied warranty
    of MERCHANTABILITY or FITNESS FOR A PARTICULAR PURPOSE.
    See the GNU Affero General Public License for more details.

    You should have received a copy of the GNU Affero General Public License
    along with this program; if not, write to the Free Software
    Foundation, Inc., 51 Franklin St, Fifth Floor, Boston, MA  02110-1301  USA
    ***************************************************************************

-->
<model plugin="full" name="firstEntity" insertable="false"
	activable="true" auditable="true" deletable="false"
	xmlns:xsi="http://www.w3.org/2001/XMLSchema-instance" xmlns="http://schema.qcadoo.org/model"
	xsi:schemaLocation="http://schema.qcadoo.org/model http://schema.qcadoo.org/model.xsd">
	<fields>
		<integer name="fieldInteger" required="true" unique="true" copyable="false">
			<validatesWith class="com.qcadoo.model.CustomHook"
				method="validateField" />
			<validatesLength min="1" max="3" />
			<validatesUnscaledValue min="2" max="4" />
			<validatesRange from="18" exclusively="true" />
		</integer>
		<string name="fieldString" default="ala" required="true" unique="false">
			<validatesLength is="2" />
			<validatesRange from="daap" to="dzzp" />
			<validatesRegex pattern="d??p" />
		</string>
		<string name="fieldStringWithoutValidators" />
		<text name="fieldText" readonly="true" />
		<string name="fieldStringNotPersistent" persistent="false" />
		<string name="fieldStringWithExpression" expression="#fString" />
		<decimal name="fieldDecimal">
			<validatesScale min="2" max="4" />
			<validatesUnscaledValue is="2" />
		</decimal>
		<decimal name="fieldDecimalOnlyWithScale">
			<validatesScale min="2" max="4" />
		</decimal>
		<decimal name="fieldDecimalWithoutValidators" />
		<datetime name="fieldDatetime" required="false" />
		<date name="fieldDate" />
		<boolean name="fieldBoolean" />
		<belongsTo name="fieldThirdEntity" model="thirdEntity" lazy="false" />
		<belongsTo name="fieldSecondEntity" plugin="other" model="secondEntity"
			lazy="false" />
		<belongsTo name="fieldSecondEntity2" plugin="other" model="secondEntity"
			lazy="true" required="true" />
		<tree name="fieldTree" model="secondEntity" cascade="delete"
			joinField="fieldFirstEntity" />
		<hasMany name="fieldHasMany" model="thirdEntity" cascade="nullify"
			joinField="fieldFirstEntity" />
		<manyToMany name="fieldManyToMany" model="thirdEntity"
			cascade="delete" joinField="fieldManyToMany" />
		<dictionary name="fieldDictionary" dictionary="categories" />
		<dictionary name="fieldOtherDictionary" dictionary="categories" />
		<enum name="fieldEnum" values="one,two,three" />
		<password name="fieldPassword" />
		<priority name="fieldPriority" scope="fieldInteger" />
	</fields>
	<hooks>
		<validatesWith class="com.qcadoo.model.CustomHook"
			method="validate" />
		<onSave class="com.qcadoo.model.CustomHook" method="hook" />
		<onUpdate class="com.qcadoo.model.CustomHook" method="updateHook" />
		<onCreate class="com.qcadoo.model.CustomHook" method="createHook" />
		<onCopy class="com.qcadoo.model.CustomHook" method="copyHook" />
		<onDelete class="com.qcadoo.model.CustomHook" method="deleteHook" />
	</hooks>
	<identifier expression="#fieldString" />
</model>