<?xml version="1.0" encoding="UTF-8"?>
<!--

    ***************************************************************************
    Copyright (c) 2010 Qcadoo Limited
    Project: Qcadoo Framework
    Version: 1.2.0

    This file is part of Qcadoo.

    Qcadoo is free software; you can redistribute it and/or modify
    it under the terms of the GNU Affero General Public License as published
    by the Free Software Foundation; either version 3 of the License,
    or (at your option) any later version.

    This program is distributed in the hope that it will be useful,
    but WITHOUT ANY WARRANTY; without even the implied warranty
    of MERCHANTABILITY or FITNESS FOR A PARTICULAR PURPOSE.
    See the GNU Affero General Public License for more details.

    You should have received a copy of the GNU Affero General Public License
    along with this program; if not, write to the Free Software
    Foundation, Inc., 51 Franklin St, Fifth Floor, Boston, MA  02110-1301  USA
    ***************************************************************************

-->
<model name="part" 
	xmlns:xsi="http://www.w3.org/2001/XMLSchema-instance" xmlns="http://schema.qcadoo.org/model"
	xsi:schemaLocation="http://schema.qcadoo.org/model http://schema.qcadoo.org/model.xsd">
	<fields>
		<string name="name" required="true" />
		<belongsTo name="product" model="product" required="false"
			lazy="false" />
		<belongsTo name="component" model="component" required="false"
			lazy="false" />
		<manyToMany name="products" model="product" plugin="products" joinField="partsManyToMany" cascade="nullify" />
		<decimal name="price" />
		<integer name="weight" />
		<text name="description" />
		<text name="longDescription">
			<validatesLength max="4096" />
		</text>
		<password name="discountCode" />
		<password name="longDiscountCode">
			<validatesLength max="512"/>
		</password>
		<boolean name="deletionIsProhibited" />
		
 		<hasMany name="factories" joinField="parentPart" model="factory" cascade="delete" />
	</fields>
	<hooks>
		<onDelete class="com.qcadoo.model.integration.VerifyHooks" method="onDeleteUsingBooleanField2" />
	</hooks>
</model>